{
  "id": "achievement/paleontologist-the-lost-challenger",
  "lore": 3939,
  "parent": "achievement/paleontologist-3753",
  "client_name": "Paleontologist_Lost Creations_Get to Level 5",
  "title": "Paleontologist, the Lost Challenger",
  "text": "Complete level 5 in the Lost Creations with Paleontologist.",
  "points": 50,
  "kind": "lost_creations",
  "minifigure": "minifig/paleontologist",
  "n": 5,
  "source": "client"
}
