{
  "id": "achievement/genie-girl-swamp-tunnel",
  "lore": 3109,
  "parent": "achievement/genie-girl",
  "client_name": "Genie Girl_Swamp Tunnel",
  "title": "Genie Girl: Swamp Tunnel",
  "text": "Conquer the Swamp Tunnel as Genie Girl.",
  "points": 50,
  "kind": "target",
  "target": "Swamp Tunnel",
  "minifigure": "minifig/genie-girl",
  "source": "client"
}
