{
  "id": "achievement/plant-monster-the-builder",
  "lore": 4568,
  "parent": "achievement/plant-monster",
  "client_name": "Plant Monster_Build 100 buildies",
  "title": "Plant Monster, the Builder",
  "text": "Build 100 buildies as Plant Monster.",
  "points": 50,
  "kind": "counter",
  "counter": [3000112, 100],
  "minifigure": "minifig/plant-monster",
  "counts": {
    "what": "builds"
  },
  "source": "client"
}
