{
  "id": "achievement/gold-digger",
  "lore": 907,
  "parent": "achievement/your-personal-odyssey",
  "client_name": "Mythology_Exploration_Hidden Roof",
  "title": "Gold Digger!",
  "text": "Find the scattered gold stash in the Underworld.",
  "points": 25,
  "kind": "find",
  "world": "world/underworld",
  "find": "BA_Explore_Roof",
  "place": "Scattered gold stash",
  "source": "client"
}
