{
  "id": "achievement/ghostbuster",
  "lore": 723,
  "parent": "achievement/pirate-story",
  "client_name": "Pirate_Story_Defeat Captain Dreadleg",
  "title": "Ghostbuster",
  "text": "Vanquish the menace of the Pirate World.",
  "points": 100,
  "kind": "defeat",
  "stars": 500,
  "target": "Captain Dreadleg",
  "source": "client"
}
