{
  "id": "achievement/banshee",
  "lore": 4385,
  "parent": "achievement/series-14",
  "client_name": "Banshee",
  "title": "Banshee",
  "points": 100,
  "kind": "all",
  "children": [
    "achievement/heroic-banshee",
    "achievement/legendary-banshee",
    "achievement/banshee-wind-shrine",
    "achievement/banshee-ancient-ruins",
    "achievement/banshee-treasure-island",
    "achievement/banshee-temper",
    "achievement/banshee-the-bridge-troll",
    "achievement/banshee-kruun-super-genius",
    "achievement/novice-banshee",
    "achievement/expert-banshee",
    "achievement/banshee-the-lost-challenger",
    "achievement/banshee-the-lost-warrior",
    "achievement/banshee-the-lost-champion",
    "achievement/banshee-the-smasher",
    "achievement/banshee-the-master-smasher",
    "achievement/banshee-the-machinist"
  ],
  "minifigure": "minifig/banshee",
  "source": "client"
}
