{
  "id": "achievement/goblin-ouch-ouch",
  "lore": 3884,
  "parent": "achievement/goblin",
  "client_name": "Goblin_Ouch Ouch",
  "title": "Goblin: Ouch Ouch",
  "text": "Defeat Ouch Ouch as Goblin.",
  "points": 25,
  "kind": "target",
  "target": "Ouch Ouch",
  "minifigure": "minifig/goblin",
  "source": "client"
}
