{
  "id": "achievement/monster-rocker",
  "lore": 4399,
  "parent": "achievement/series-14",
  "client_name": "Monster Rocker",
  "title": "Monster Rocker",
  "points": 100,
  "kind": "all",
  "children": [
    "achievement/heroic-monster-rocker",
    "achievement/legendary-monster-rocker",
    "achievement/monster-rocker-mercenary-troop-transport",
    "achievement/monster-rocker-underground-cave",
    "achievement/monster-rocker-alien-command-center",
    "achievement/monster-rocker-roar-the-gladiator",
    "achievement/monster-rocker-janos-the-unforgiving",
    "achievement/monster-rocker-chunk-the-tiger",
    "achievement/novice-monster-rocker",
    "achievement/expert-monster-rocker",
    "achievement/monster-rocker-the-lost-challenger",
    "achievement/monster-rocker-the-lost-warrior",
    "achievement/monster-rocker-the-lost-champion",
    "achievement/monster-rocker-the-smasher",
    "achievement/monster-rocker-the-master-smasher",
    "achievement/monster-rocker-the-sweet"
  ],
  "minifigure": "minifig/monster-rocker",
  "source": "client"
}
