{
  "id": "achievement/heroic-video-game-guy",
  "lore": 3306,
  "parent": "achievement/video-game-guy",
  "client_name": "Video Game Guy_Complete Any 5",
  "title": "Heroic Video Game Guy",
  "text": "Complete any 5 Video Game Guy achievements.",
  "points": 25,
  "kind": "any",
  "stars": 250,
  "minifigure": "minifig/video-game-guy",
  "n": 5,
  "source": "client"
}
