{
  "id": "achievement/trololol",
  "lore": 784,
  "parent": "achievement/trial-by-combat",
  "client_name": "Medieval_Combat_Champion_Derp the Internet Troll",
  "title": "Trololol",
  "text": "Defeat Derp the Internet Troll in the Medieval World.",
  "points": 25,
  "kind": "defeat",
  "target": "Derp the Internet Troll",
  "source": "client"
}
