{
  "id": "achievement/chicken-suit-guy-the-master-builder",
  "lore": 2681,
  "parent": "achievement/chicken-suit-guy",
  "client_name": "Chicken Suit Guy_Build 1000 Buildies",
  "title": "Chicken Suit Guy, the Master Builder",
  "text": "Build 1000 buildies as Chicken Suit Guy.",
  "points": 50,
  "kind": "counter",
  "counter": [3000112, 1000],
  "minifigure": "minifig/chicken-suit-guy",
  "counts": {
    "what": "builds"
  },
  "source": "client"
}
