{
  "id": "achievement/plant-monster-ridgeback-spitter",
  "lore": 4561,
  "parent": "achievement/plant-monster",
  "client_name": "Plant Monster_Ridgeback Spitter",
  "title": "Plant Monster: Ridgeback Spitter",
  "text": "Defeat Ridgeback Spitter as Plant Monster.",
  "points": 25,
  "kind": "target",
  "target": "Ridgeback Spitter",
  "minifigure": "minifig/plant-monster",
  "source": "client"
}
