{
  "id": "achievement/dreadleg-s-favorite-hat",
  "lore": 2420,
  "parent": "achievement/pirate-collectibles",
  "client_name": "Pirate_Collectibles_Dreadleg's Treasure",
  "title": "Dreadleg's Favorite Hat",
  "text": "Find Dreadleg's Favorite Hat in the Pirate World.",
  "points": 50,
  "kind": "find",
  "find": "collectible_dreadlegs_treasure",
  "place": "Dreadleg's Favorite Hat",
  "source": "client"
}
