{
  "id": "achievement/expert-goblin",
  "lore": 3886,
  "parent": "achievement/goblin",
  "client_name": "Goblin_Upgrade 7",
  "title": "Expert Goblin",
  "text": "Get the seventh Goblin upgrade.",
  "points": 25,
  "kind": "upgrade",
  "minifigure": "minifig/goblin",
  "n": 7,
  "source": "client"
}
